[
  {
    "Date": "2025-09-19",
    "Qui": "Groupe",
    "Type": "Bar Pi",
    "Activité": "Bar Pi #1",
    "Détails": "Tout le monde présent, grosse caisse, sympa :)",
    "Montant": 150.03
  },
  {
    "Date": "2025-09-20",
    "Qui": "Ocicat",
    "Type": "Vente",
    "Activité": "Cookies",
    "Détails": "Dans quartier",
    "Montant": 65 
  },
  {
    "Date": "2025-09-27",
    "Qui": "Dorcopsis, Sika, Merione, Charlotte, Chousingha, Nathan",
    "Type": "Caisses",
    "Activité": "Delhaize",
    "Détails": "Delhaize Fort Jaco",
    "Montant": 295.36
  },
  {
    "Date": "2025-09-29",
    "Qui": "Dorcopsis",
    "Type": "Pourboires",
    "Activité": "Resto",
    "Détails": "",
    "Montant": 40
  },
  {
    "Date": "2025-10-05",
    "Qui": "Nevala, Tanuki",
    "Type": "Vente",
    "Activité": "Cookies & Brochettes de bonbons",
    "Détails": "Marché de Waterloo",
    "Montant": 161.5
  },
  {
    "Date": "2025-10-09",
    "Qui": "Charlotte",
    "Type": "Babysitting",
    "Activité": "",
    "Détails": "",
    "Montant": 10
  },
  {
    "Date": "2025-10-09",
    "Qui": "Merione",
    "Type": "Babysitting",
    "Activité": "",
    "Détails": "",
    "Montant": 27
  },
  {
    "Date": "2025-10-12",
    "Qui": "Chousingha, Charlotte, Adrien, Taguan, Merione",
    "Type": "Action",
    "Activité": "Chaussettes",
    "Détails": "Vague 1",
    "Montant": [33, 21, 60, 48, 111]
  },
  {
    "Date": "2025-10-18",
    "Qui": "Viktor, Taguan, Adrien",
    "Type": "Caisses",
    "Activité": "Grande Epicerie",
    "Détails": "Grande Epicerie Fort Jaco",
    "Montant": 206.5
  },
  {
    "Date": "2025-10-19",
    "Qui": "Dorcopsis, Sika, Chousingha",
    "Type": "Caisses",
    "Activité": "Delhaize",
    "Détails": "Delhaize Fort Jaco",
    "Montant": 303.78
  },
  {
    "Date": "2025-10-24",
    "Qui": "Merione",
    "Type": "Travail perso",
    "Activité": "Travail perso",
    "Détails": "Aide Tatie Crouton",
    "Montant": 100
  },
  {
    "Date": "2025-10-31",
    "Qui": "Nevala, Tanuki",
    "Type": "Vente",
    "Activité": "Cookies",
    "Détails": "Dans quartier",
    "Montant": 113.8
  },
  {
    "Date": "2025-11-01",
    "Qui": "Taguan, Adrien, Chousingha, Merione, Dorcopsis",
    "Type": "Action",
    "Activité": "Calendriers",
    "Détails": "",
    "Montant": [34, 28, 22, 15, 12]
  },
  {
    "Date": "2025-11-01",
    "Qui": "Groupe",
    "Type": "Bar Pi",
    "Activité": "Bar Pi #2",
    "Détails": "Bonne édition, vla du monde",
    "Montant": 242.14

  },
  {
    "Date": "2025-11-03",
    "Qui": "Sika",
    "Type": "Travail perso",
    "Activité": "Travail perso",
    "Détails": "Aide maman",
    "Montant": 85
  },
  {
    "Date": "2025-11-08",
    "Qui": "Merione, Tanuki",
    "Type": "Caisses",
    "Activité": "Grande Epicerie",
    "Détails": "Grande Epicerie Fort Jaco",
    "Montant": 157.20
  },
  {
    "Date": "2025-11-14",
    "Qui": "Nevala, Dorcopsis, Sika, Adrien, Ocicat",
    "Type": "Action",
    "Activité": "Chaussettes",
    "Détails": "Vagues 2 & 3",
    "Montant": [48, 45, 33, 12, 330]
  },
  {
    "Date": "2025-11-15",
    "Qui": "Sika, Dorcopsis",
    "Type": "Caisses",
    "Activité": "Delhaize",
    "Détails": "Delhaize Fort Jaco",
    "Montant": 137.2
  },
  {
    "Date": "2025-11-16",
    "Qui": "Chousingha, Nevala",
    "Type": "Caisses",
    "Activité": "Delhaize",
    "Détails": "Delhaize Fort Jaco",
    "Montant": [80, 99.80]
  },
  {
    "Date": "2025-12-05",
    "Qui": "Sika",
    "Type": "Travail perso",
    "Activité": "Travail perso",
    "Détails": "Aide maman",
    "Montant": 69.7
  },
  {
    "Date": "2025-12-07",
    "Qui": "Groupe, Taguan, Charlotte, Dorcopsis, Chousingha, Merione, Ocicat, Tanuki, Viktor",
    "Type": "Action",
    "Activité": "Sapins",
    "Détails": "",
    "Montant": [1143, 30, 15, 15, 15, 75, 60, 45, 120]
  },
  {
    "Date": "2025-12-21",
    "Qui": "Nevala, Merione",
    "Type": "Vente",
    "Activité": "Cookies",
    "Détails": "Magasin vin",
    "Montant": [100, 102.5]
  },
  {
    "Date": "2025-12-21",
    "Qui": "Tanuki, Chousingha, Taguan, Dorcopsis",
    "Type": "Caisses",
    "Activité": "Carrefour",
    "Détails": "Carrefour Waterloo",
    "Montant": [35, 56.8, 56.8, 56.8]
  },
  {
    "Date": "2025-12-23",
    "Qui": "Dorcopsis, Tanuki",
    "Type": "Caisses",
    "Activité": "Carrefour",
    "Détails": "Carrefour Waterloo",
    "Montant": [63.4, 30]
  },
  {
    "Date": "2025-12-24",
    "Qui": "Adrien, Taguan",
    "Type": "Caisses",
    "Activité": "Carrefour",
    "Détails": "Carrefour Waterloo",
    "Montant": 163
  },
  {
    "Date": "2025-12-27",
    "Qui": "Merione, Tanuki",
    "Type": "Caisses",
    "Activité": "Grande Epicerie",
    "Détails": "Grande Epicerie Fort Jaco",
    "Montant": 170
  },
  {
    "Date": "2025-12-30",
    "Qui": "Chousingha, Tanuki",
    "Type": "Caisses",
    "Activité": "Grande Epicerie",
    "Détails": "Grande Epicerie Fort Jaco",
    "Montant": [175.20, 56.60]
  },
  {
    "Date": "2025-12-31",
    "Qui": "Groupe, Dorcopsis, Tanuki, Viktor, Taguan",
    "Type": "Action",
    "Activité": "Vin",
    "Détails": "",
    "Montant": [151.27, 13.06, 52.1, 8.51, 48.72]
  }
]